<?xml version="1.0" encoding="utf-8"?>
<!-- Copyright (C) 2010 The Android Open Source Project
     Copyright (C) 2012-2018 The Linux Foundation. All rights reserved.
     Not a contribution.

     Licensed under the Apache License, Version 2.0 (the "License");
     you may not use this file except in compliance with the License.
     You may obtain a copy of the License at

          http://www.apache.org/licenses/LICENSE-2.0

     Unless required by applicable law or agreed to in writing, software
     distributed under the License is distributed on an "AS IS" BASIS,
     WITHOUT WARRANTIES OR CONDITIONS OF ANY KIND, either express or implied.
     See the License for the specific language governing permissions and
     limitations under the License.
-->
<!DOCTYPE MediaSettings [
<!ELEMENT MediaSettings (CamcorderProfiles,
                         EncoderOutputFileFormat+,
                         VideoEncoderCap+,
                         AudioEncoderCap+,
                         VideoDecoderCap,
                         AudioDecoderCap)>
<!ELEMENT CamcorderProfiles (EncoderProfile+, ImageEncoding+, ImageDecoding, Camera)>
<!ELEMENT EncoderProfile (Video, Audio)>
<!ATTLIST EncoderProfile quality (high|low) #REQUIRED>
<!ATTLIST EncoderProfile fileFormat (mp4|3gp) #REQUIRED>
<!ATTLIST EncoderProfile duration (30|60) #REQUIRED>
<!ATTLIST EncoderProfile cameraId (0|1) #REQUIRED>
<!ELEMENT Video EMPTY>
<!ATTLIST Video codec (h264|h263|m4v) #REQUIRED>
<!ATTLIST Video bitRate CDATA #REQUIRED>
<!ATTLIST Video width CDATA #REQUIRED>
<!ATTLIST Video height CDATA #REQUIRED>
<!ATTLIST Video frameRate CDATA #REQUIRED>
<!ELEMENT Audio EMPTY>
<!ATTLIST Audio codec (amrnb|amrwb|aac|lpcm) #REQUIRED>
<!ATTLIST Audio bitRate CDATA #REQUIRED>
<!ATTLIST Audio sampleRate CDATA #REQUIRED>
<!ATTLIST Audio channels (1|2|6) #REQUIRED>
<!ELEMENT ImageEncoding EMPTY>
<!ATTLIST ImageEncoding quality (90|80|70|60|50|40) #REQUIRED>
<!ELEMENT ImageDecoding EMPTY>
<!ATTLIST ImageDecoding memCap CDATA #REQUIRED>
<!ELEMENT Camera EMPTY>
<!ELEMENT EncoderOutputFileFormat EMPTY>
<!ATTLIST EncoderOutputFileFormat name (mp4|3gp) #REQUIRED>
<!ELEMENT VideoEncoderCap EMPTY>
<!ATTLIST VideoEncoderCap name (hevc|h264|h263|m4v|wmv) #REQUIRED>
<!ATTLIST VideoEncoderCap enabled (true|false) #REQUIRED>
<!ATTLIST VideoEncoderCap minBitRate CDATA #REQUIRED>
<!ATTLIST VideoEncoderCap maxBitRate CDATA #REQUIRED>
<!ATTLIST VideoEncoderCap minFrameWidth CDATA #REQUIRED>
<!ATTLIST VideoEncoderCap maxFrameWidth CDATA #REQUIRED>
<!ATTLIST VideoEncoderCap minFrameHeight CDATA #REQUIRED>
<!ATTLIST VideoEncoderCap maxFrameHeight CDATA #REQUIRED>
<!ATTLIST VideoEncoderCap minFrameRate CDATA #REQUIRED>
<!ATTLIST VideoEncoderCap maxFrameRate CDATA #REQUIRED>
<!ATTLIST VideoEncoderCap maxHFRFrameWidth CDATA #REQUIRED>
<!ATTLIST VideoEncoderCap maxHFRFrameHeight CDATA #REQUIRED>
<!ATTLIST VideoEncoderCap maxHFRMode CDATA #REQUIRED>
<!ELEMENT AudioEncoderCap EMPTY>
<!ATTLIST AudioEncoderCap name (amrnb|amrwb|aac|wma|lpcm) #REQUIRED>
<!ATTLIST AudioEncoderCap enabled (true|false) #REQUIRED>
<!ATTLIST AudioEncoderCap minBitRate CDATA #REQUIRED>
<!ATTLIST AudioEncoderCap maxBitRate CDATA #REQUIRED>
<!ATTLIST AudioEncoderCap minSampleRate CDATA #REQUIRED>
<!ATTLIST AudioEncoderCap maxSampleRate CDATA #REQUIRED>
<!ATTLIST AudioEncoderCap minChannels (1|2|6) #REQUIRED>
<!ATTLIST AudioEncoderCap maxChannels (1|2|6) #REQUIRED>
<!ELEMENT VideoDecoderCap EMPTY>
<!ATTLIST VideoDecoderCap name (wmv) #REQUIRED>
<!ATTLIST VideoDecoderCap enabled (true|false) #REQUIRED>
<!ELEMENT AudioDecoderCap EMPTY>
<!ATTLIST AudioDecoderCap name (wma) #REQUIRED>
<!ATTLIST AudioDecoderCap enabled (true|false) #REQUIRED>
<!ELEMENT VideoEditorCap EMPTY>
<!ATTLIST VideoEditorCap maxInputFrameWidth CDATA #REQUIRED>
<!ATTLIST VideoEditorCap maxInputFrameHeight CDATA #REQUIRED>
<!ATTLIST VideoEditorCap maxOutputFrameWidth CDATA #REQUIRED>
<!ATTLIST VideoEditorCap maxOutputFrameHeight CDATA #REQUIRED>
<!ATTLIST VideoEditorCap maxPrefetchYUVFrames CDATA #REQUIRED>
<!ELEMENT ExportVideoProfile EMPTY>
<!ATTLIST ExportVideoProfile name (h264|h263|m4v) #REQUIRED>
<!ATTLIST ExportVideoProfile profile CDATA #REQUIRED>
<!ATTLIST ExportVideoProfile level CDATA #REQUIRED>
]>
<!--
     This file is used to declare the multimedia profiles and capabilities
     on an android-powered device.
-->
<MediaSettings>
    <!-- Each camcorder profile defines a set of predefined configuration parameters -->
    <!-- Back Camera -->
<!-- #ifndef VENDOR_EDIT -->
<!-- huxin@PSW.MM.MediaServer.Record.1883500, 2019/03/07, -->
<!-- Modify for avoiding video recording signal tone -->
<!--
    <CamcorderProfiles cameraId="0">
-->
<!-- #else  //VENDOR_EDIT -->
    <CamcorderProfiles cameraId="0" startOffsetMs="600">
<!-- #endif //VENDOR_EDIT -->

    <EncoderProfile quality="low" fileFormat="3gp" duration="30">
      <Video codec="h264"
             bitRate="192000"
             width="176"
             height="144"
             frameRate="60" />

      <Audio codec="amrnb"
             bitRate="12200"
             sampleRate="8000"
             channels="1" />
    </EncoderProfile>

    <EncoderProfile quality="high" fileFormat="mp4" duration="30">
<!-- #ifndef VENDOR_EDIT -->
<!-- HuXin@PSW.MM.MediaServer.CTS.1784928, 2019/02/13, -->
<!-- Modify for deleting 4K video recording -->
<!--
      <Video codec="h264"
             bitRate="42000000"
             width="3840"
             height="2160"
             frameRate="60" />
-->
<!-- #else  //VENDOR_EDIT -->
      <Video codec="h264"
             bitRate="20000000"
             width="1920"
             height="1080"
             frameRate="60" />
<!-- #endif //VENDOR_EDIT -->

      <Audio codec="aac"
             bitRate="156000"
             sampleRate="48000"
             channels="2" />
    </EncoderProfile>

    <EncoderProfile quality="qvga" fileFormat="mp4" duration="60">
      <Video codec="h264"
             bitRate="512000"
             width="320"
             height="240"
             frameRate="60" />

      <Audio codec="aac"
             bitRate="156000"
             sampleRate="48000"
             channels="2" />
    </EncoderProfile>

    <EncoderProfile quality="cif" fileFormat="3gp" duration="30">
      <Video codec="h264"
             bitRate="720000"
             width="352"
             height="288"
             frameRate="60" />

      <Audio codec="amrnb"
             bitRate="12200"
             sampleRate="8000"
             channels="1" />
    </EncoderProfile>

    <EncoderProfile quality="480p" fileFormat="mp4" duration="30">
      <Video codec="h264"
             bitRate="2000000"
             width="720"
             height="480"
             frameRate="60" />

      <Audio codec="aac"
             bitRate="156000"
             sampleRate="48000"
             channels="2" />
    </EncoderProfile>

    <EncoderProfile quality="720p" fileFormat="mp4" duration="30">
      <Video codec="h264"
             bitRate="14000000"
             width="1280"
             height="720"
             frameRate="60" />

      <Audio codec="aac"
             bitRate="156000"
             sampleRate="48000"
             channels="2" />
    </EncoderProfile>

    <EncoderProfile quality="1080p" fileFormat="mp4" duration="30">
      <Video codec="h264"
             bitRate="20000000"
             width="1920"
             height="1080"
             frameRate="60" />

      <Audio codec="aac"
             bitRate="156000"
             sampleRate="48000"
             channels="2" />
    </EncoderProfile>

    <EncoderProfile quality="4kdci" fileFormat="mp4" duration="30">
      	    <Video codec="h264"
            	   bitRate="42000000"
            	   width="4096"
            	   height="2160"
            	   frameRate="60" />

            <Audio codec="aac"
                   bitRate="96000"
                   sampleRate="48000"
                   channels="1" />
        </EncoderProfile>

        <EncoderProfile quality="2160p" fileFormat="mp4" duration="30">
            <Video codec="h264"
            	   bitRate="42000000"
            	   width="3840"
            	   height="2160"
            	   frameRate="60" />

            <Audio codec="aac"
                   bitRate="96000"
                   sampleRate="48000"
                   channels="1" />
    	</EncoderProfile>

<!-- #ifndef VENDOR_EDIT -->
<!-- HuXin@PSW.MM.MediaServer.CTS.1784928, 2019/02/13, -->
<!-- Remove for deleting 4K video recording -->
<!--
    <EncoderProfile quality="qhd" fileFormat="mp4" duration="30">
      <Video codec="h264"
             bitRate="42000000"
             width="2560"
             height="1440"
             frameRate="60" />

      <Audio codec="aac"
             bitRate="156000"
             sampleRate="48000"
             channels="2" />
    </EncoderProfile>

    <EncoderProfile quality="2k" fileFormat="mp4" duration="30">
      <Video codec="h264"
             bitRate="20000000"
             width="2048"
             height="1080"
             frameRate="60" />

      <Audio codec="aac"
             bitRate="156000"
             sampleRate="48000"
             channels="2" />
    </EncoderProfile>

    <EncoderProfile quality="2160p" fileFormat="mp4" duration="30">
      <Video codec="h264"
            bitRate="42000000"
            width="3840"
            height="2160"
            frameRate="60" />

      <Audio codec="aac"
            bitRate="156000"
            sampleRate="48000"
            channels="2" />
    </EncoderProfile>
-->
<!-- #endif //VENDOR_EDIT -->

    <EncoderProfile quality="qcif" fileFormat="3gp" duration="30">
      <Video codec="h264"
             bitRate="192000"
             width="176"
             height="144"
             frameRate="60" />

      <Audio codec="amrnb"
             bitRate="12200"
             sampleRate="8000"
             channels="1" />
    </EncoderProfile>

    <EncoderProfile quality="vga" fileFormat="mp4" duration="30">
      <Video codec="h264"
             bitRate="2000000"
             width="640"
             height="480"
             frameRate="60" />

      <Audio codec="aac"
             bitRate="156000"
             sampleRate="48000"
             channels="2" />
    </EncoderProfile>

    <EncoderProfile quality="timelapselow" fileFormat="mp4" duration="30">
      <Video codec="h264"
             bitRate="192000"
             width="176"
             height="144"
             frameRate="60" />

      <!-- audio setting is ignored -->
      <Audio codec="amrnb"
             bitRate="12200"
             sampleRate="8000"
             channels="1" />
    </EncoderProfile>

    <EncoderProfile quality="timelapsehigh" fileFormat="mp4" duration="30">
<!-- #ifndef VENDOR_EDIT -->
<!-- HuXin@PSW.MM.MediaServer.CTS.1784928, 2019/02/13, -->
<!-- Modify for deleting 4K video recording -->
<!--
      <Video codec="h264"
             bitRate="42000000"
             width="3840"
             height="2160"
             frameRate="60" />
-->
<!-- #else  //VENDOR_EDIT -->
      <Video codec="h264"
             bitRate="20000000"
             width="1920"
             height="1080"
             frameRate="60" />
<!-- #endif //VENDOR_EDIT -->

      <!-- audio setting is ignored -->
      <Audio codec="aac"
             bitRate="156000"
             sampleRate="48000"
             channels="2" />
    </EncoderProfile>

    <EncoderProfile quality="timelapseqcif" fileFormat="mp4" duration="30">
      <Video codec="h264"
             bitRate="192000"
             width="176"
             height="144"
             frameRate="60" />

      <!-- audio setting is ignored -->
      <Audio codec="amrnb"
             bitRate="12200"
             sampleRate="8000"
             channels="1" />
    </EncoderProfile>

    <EncoderProfile quality="timelapsecif" fileFormat="mp4" duration="30">
      <Video codec="h264"
             bitRate="720000"
             width="352"
             height="288"
             frameRate="60" />

      <!-- audio setting is ignored -->
      <Audio codec="amrnb"
             bitRate="12200"
             sampleRate="8000"
             channels="1" />
    </EncoderProfile>


    <EncoderProfile quality="timelapseqvga" fileFormat="mp4" duration="30">
      <Video codec="h264"
             bitRate="512000"
             width="320"
             height="240"
             frameRate="60" />

      <!-- audio setting is ignored -->
      <Audio codec="amrnb"
             bitRate="12200"
             sampleRate="8000"
             channels="1" />
    </EncoderProfile>

    <EncoderProfile quality="timelapsevga" fileFormat="mp4" duration="30">
      <Video codec="h264"
             bitRate="2000000"
             width="640"
             height="480"
             frameRate="60" />

      <!-- audio setting is ignored -->
      <Audio codec="amrnb"
             bitRate="12200"
             sampleRate="8000"
             channels="1" />
    </EncoderProfile>

    <EncoderProfile quality="timelapse480p" fileFormat="mp4" duration="30">
      <Video codec="h264"
             bitRate="2000000"
             width="640"
             height="480"
             frameRate="60" />

      <!-- audio setting is ignored -->
      <Audio codec="aac"
             bitRate="156000"
             sampleRate="48000"
             channels="2" />
    </EncoderProfile>

    <EncoderProfile quality="timelapse720p" fileFormat="mp4" duration="30">
      <Video codec="h264"
             bitRate="14000000"
             width="1280"
             height="720"
             frameRate="60" />

      <!-- audio setting is ignored -->
      <Audio codec="aac"
             bitRate="156000"
             sampleRate="48000"
             channels="2" />
    </EncoderProfile>

    <EncoderProfile quality="timelapse1080p" fileFormat="mp4" duration="30">
      <Video codec="h264"
             bitRate="20000000"
             width="1920"
             height="1080"
             frameRate="60" />

      <!-- audio setting is ignored -->
      <Audio codec="aac"
             bitRate="156000"
             sampleRate="48000"
             channels="2" />
    </EncoderProfile>

<!-- #ifndef VENDOR_EDIT -->
<!-- HuXin@PSW.MM.MediaServer.CTS.1784928, 2019/02/13, -->
<!-- Remove for deleting 4K video recording -->
<!--
    <EncoderProfile quality="timelapseqhd" fileFormat="mp4" duration="30">
      <Video codec="h264"
             bitRate="42000000"
             width="2560"
             height="1440"
             frameRate="60" />

      <Audio codec="aac"
             bitRate="156000"
             sampleRate="48000"
             channels="2" />
    </EncoderProfile>

    <EncoderProfile quality="timelapse2k" fileFormat="mp4" duration="30">
      <Video codec="h264"
             bitRate="20000000"
             width="2048"
             height="1080"
             frameRate="60" />

      <Audio codec="aac"
             bitRate="156000"
             sampleRate="48000"
             channels="2" />
    </EncoderProfile>

    <EncoderProfile quality="timelapse2160p" fileFormat="mp4" duration="30">
      <Video codec="h264"
            bitRate="42000000"
            width="3840"
            height="2160"
            frameRate="60" />

      <Audio codec="aac"
            bitRate="156000"
            sampleRate="48000"
            channels="2" />
    </EncoderProfile>
-->
<!-- #endif //VENDOR_EDIT -->

        <ImageEncoding quality="95" />
        <ImageEncoding quality="80" />
        <ImageEncoding quality="70" />
        <ImageDecoding memCap="20000000" />

    </CamcorderProfiles>
    <!-- Front Camera -->
<!-- #ifndef VENDOR_EDIT -->
<!-- huxin@PSW.MM.MediaServer.Record.1883500, 2019/03/07, -->
<!-- Modify for avoiding video recording signal tone -->
<!--
    <CamcorderProfiles cameraId="1">
-->
<!-- #else  //VENDOR_EDIT -->
    <CamcorderProfiles cameraId="1" startOffsetMs="600">
<!-- #endif //VENDOR_EDIT -->

    <EncoderProfile quality="low" fileFormat="3gp" duration="30">
      <Video codec="h264"
             bitRate="192000"
             width="176"
             height="144"
             frameRate="60" />

      <Audio codec="amrnb"
             bitRate="12200"
             sampleRate="8000"
             channels="1" />
    </EncoderProfile>

<!-- #ifndef VENDOR_EDIT -->
<!-- HuXin@PSW.MM.MediaServer.CTS.1784928, 2019/02/13, -->
<!-- Modify for deleting 4K video recording -->
<!--
    <EncoderProfile quality="high" fileFormat="mp4" duration="30">
      <Video codec="h264"
             bitRate="20000000"
             width="1920"
             height="1080"
             frameRate="60" />

      <Audio codec="aac"
             bitRate="156000"
             sampleRate="48000"
             channels="2" />
    </EncoderProfile>
-->
<!-- #else  //VENDOR_EDIT -->
    <EncoderProfile quality="high" fileFormat="mp4" duration="30">
      <Video codec="h264"
             bitRate="20000000"
             width="1920"
             height="1080"
             frameRate="60" />

      <Audio codec="aac"
             bitRate="156000"
             sampleRate="48000"
             channels="2" />
    </EncoderProfile>
<!-- #endif //VENDOR_EDIT -->

    <EncoderProfile quality="qvga" fileFormat="mp4" duration="60">
      <Video codec="h264"
             bitRate="512000"
             width="320"
             height="240"
             frameRate="60" />

      <Audio codec="aac"
             bitRate="156000"
             sampleRate="48000"
             channels="2" />
    </EncoderProfile>

    <EncoderProfile quality="cif" fileFormat="3gp" duration="30">
      <Video codec="h264"
             bitRate="720000"
             width="352"
             height="288"
             frameRate="60" />

      <Audio codec="amrnb"
             bitRate="12200"
             sampleRate="8000"
             channels="1" />
    </EncoderProfile>

    <EncoderProfile quality="480p" fileFormat="mp4" duration="30">
      <Video codec="h264"
             bitRate="2000000"
             width="720"
             height="480"
             frameRate="60" />

      <Audio codec="aac"
             bitRate="156000"
             sampleRate="48000"
             channels="2" />
    </EncoderProfile>

    <EncoderProfile quality="720p" fileFormat="mp4" duration="30">
      <Video codec="h264"
             bitRate="14000000"
             width="1280"
             height="720"
             frameRate="60" />

      <Audio codec="aac"
             bitRate="156000"
             sampleRate="48000"
             channels="2" />
    </EncoderProfile>

    <EncoderProfile quality="1080p" fileFormat="mp4" duration="30">
      <Video codec="h264"
             bitRate="20000000"
             width="1920"
             height="1080"
             frameRate="60" />

      <Audio codec="aac"
             bitRate="156000"
             sampleRate="48000"
             channels="2" />
    </EncoderProfile>

<!-- #ifndef VENDOR_EDIT -->
<!-- HuXin@PSW.MM.MediaServer.CTS.1784928, 2019/02/13, -->
<!-- Remove for deleting 4K video recording -->
<!--
    <EncoderProfile quality="qhd" fileFormat="mp4" duration="30">
      <Video codec="h264"
             bitRate="42000000"
             width="2560"
             height="1440"
             frameRate="60" />

      <Audio codec="aac"
             bitRate="156000"
             sampleRate="48000"
             channels="2" />
    </EncoderProfile>

    <EncoderProfile quality="2k" fileFormat="mp4" duration="30">
      <Video codec="h264"
             bitRate="20000000"
             width="2048"
             height="1080"
             frameRate="60" />

      <Audio codec="aac"
             bitRate="156000"
             sampleRate="48000"
             channels="2" />
    </EncoderProfile>

    <EncoderProfile quality="2160p" fileFormat="mp4" duration="30">
      <Video codec="h264"
            bitRate="42000000"
            width="3840"
            height="2160"
            frameRate="60" />

      <Audio codec="aac"
            bitRate="156000"
            sampleRate="48000"
            channels="2" />
    </EncoderProfile>
-->
<!-- #endif //VENDOR_EDIT -->

    <EncoderProfile quality="qcif" fileFormat="3gp" duration="30">
      <Video codec="h264"
             bitRate="192000"
             width="176"
             height="144"
             frameRate="60" />

      <Audio codec="amrnb"
             bitRate="12200"
             sampleRate="8000"
             channels="1" />
    </EncoderProfile>

     <EncoderProfile quality="vga" fileFormat="mp4" duration="30">
      <Video codec="h264"
             bitRate="2000000"
             width="640"
             height="480"
             frameRate="60" />

      <Audio codec="aac"
             bitRate="156000"
             sampleRate="48000"
             channels="2" />
    </EncoderProfile>

    <!-- TIMELAPSE profiles for front camera -->
    <EncoderProfile quality="timelapselow" fileFormat="mp4" duration="30">
      <Video codec="h264"
             bitRate="192000"
             width="176"
             height="144"
             frameRate="60" />

      <!-- audio setting is ignored -->
      <Audio codec="amrnb"
             bitRate="12200"
             sampleRate="8000"
             channels="1" />
    </EncoderProfile>

<!-- #ifndef VENDOR_EDIT -->
<!-- HuXin@PSW.MM.MediaServer.CTS.1784928, 2019/02/13, -->
<!-- Modify for deleting 4K video recording -->
<!--
    <EncoderProfile quality="timelapsehigh" fileFormat="mp4" duration="30">
      <Video codec="h264"
             bitRate="20000000"
             width="1920"
             height="1080"
             frameRate="60" />

      <Audio codec="aac"
             bitRate="156000"
             sampleRate="48000"
             channels="2" />
    </EncoderProfile>
-->
<!-- #else  //VENDOR_EDIT -->
    <EncoderProfile quality="timelapsehigh" fileFormat="mp4" duration="30">
      <Video codec="h264"
             bitRate="20000000"
             width="1920"
             height="1080"
             frameRate="60" />

      <!-- audio setting is ignored -->
      <Audio codec="aac"
             bitRate="156000"
             sampleRate="48000"
             channels="2" />
    </EncoderProfile>
<!-- #endif //VENDOR_EDIT -->

    <EncoderProfile quality="timelapseqcif" fileFormat="mp4" duration="30">
      <Video codec="h264"
             bitRate="192000"
             width="176"
             height="144"
             frameRate="60" />

      <!-- audio setting is ignored -->
      <Audio codec="amrnb"
             bitRate="12200"
             sampleRate="8000"
             channels="1" />
    </EncoderProfile>

    <EncoderProfile quality="timelapsecif" fileFormat="mp4" duration="30">
      <Video codec="h264"
             bitRate="1200000"
             width="352"
             height="288"
             frameRate="60" />

      <!-- audio setting is ignored -->
      <Audio codec="aac"
             bitRate="96000"
             sampleRate="48000"
             channels="1" />
    </EncoderProfile>

    <EncoderProfile quality="timelapseqvga" fileFormat="mp4" duration="30">
      <Video codec="h264"
             bitRate="512000"
             width="320"
             height="240"
             frameRate="60" />

      <!-- audio setting is ignored -->
      <Audio codec="amrnb"
             bitRate="12200"
             sampleRate="8000"
             channels="1" />
    </EncoderProfile>

    <EncoderProfile quality="timelapsevga" fileFormat="mp4" duration="30">
      <Video codec="h264"
             bitRate="2000000"
             width="640"
             height="480"
             frameRate="60" />

      <!-- audio setting is ignored -->
      <Audio codec="amrnb"
             bitRate="12200"
             sampleRate="8000"
             channels="1" />
    </EncoderProfile>

    <EncoderProfile quality="timelapse480p" fileFormat="mp4" duration="30">
      <Video codec="h264"
             bitRate="5000000"
             width="720"
             height="480"
             frameRate="60" />

      <!-- audio setting is ignored -->
      <Audio codec="aac"
             bitRate="96000"
             sampleRate="48000"
             channels="1" />
    </EncoderProfile>

    <EncoderProfile quality="timelapse720p" fileFormat="mp4" duration="30">
      <Video codec="h264"
             bitRate="8000000"
             width="1280"
             height="720"
             frameRate="60" />

      <!-- audio setting is ignored -->
      <Audio codec="aac"
             bitRate="96000"
             sampleRate="48000"
             channels="1" />
    </EncoderProfile>

    <EncoderProfile quality="timelapse1080p" fileFormat="mp4" duration="30">
      <Video codec="h264"
             bitRate="20000000"
             width="1920"
             height="1080"
             frameRate="60" />

      <!-- audio setting is ignored -->
      <Audio codec="aac"
             bitRate="156000"
             sampleRate="48000"
             channels="2" />
    </EncoderProfile>

        <ImageEncoding quality="95" />
        <ImageEncoding quality="80" />
        <ImageEncoding quality="70" />
        <ImageDecoding memCap="20000000" />

    </CamcorderProfiles>

    <EncoderOutputFileFormat name="3gp" />
    <EncoderOutputFileFormat name="mp4" />

    <!--
         If a codec is not enabled, it is invisible to the applications
         In other words, the applications won't be able to use the codec
         or query the capabilities of the codec at all if it is disabled
    -->
    <VideoEncoderCap name="h264" enabled="true"
        minBitRate="64000" maxBitRate="42000000"
        minFrameWidth="176" maxFrameWidth="4096"
        minFrameHeight="144" maxFrameHeight="2160"
        minFrameRate="15" maxFrameRate="30"
        maxHFRFrameWidth="1920" maxHFRFrameHeight="1080"
        maxHFRMode="120"  />

    <VideoEncoderCap name="h263" enabled="true"
        minBitRate="64000" maxBitRate="2000000"
        minFrameWidth="176" maxFrameWidth="800"
        minFrameHeight="144" maxFrameHeight="480"
        minFrameRate="15" maxFrameRate="30"
        maxHFRFrameWidth="0" maxHFRFrameHeight="0"
        maxHFRMode="0"  />

    <VideoEncoderCap name="m4v" enabled="true"
        minBitRate="64000" maxBitRate="20000000"
        minFrameWidth="176" maxFrameWidth="1280"
        minFrameHeight="144" maxFrameHeight="720"
        minFrameRate="15" maxFrameRate="30"
        maxHFRFrameWidth="0" maxHFRFrameHeight="0"
        maxHFRMode="0"  />

    <VideoEncoderCap name="hevc" enabled="true"
        minBitRate="64000" maxBitRate="100000000"
        minFrameWidth="176" maxFrameWidth="4096"
        minFrameHeight="144" maxFrameHeight="2160"
        minFrameRate="15" maxFrameRate="30"
        maxHFRFrameWidth="0" maxHFRFrameHeight="0"
        maxHFRMode="0"  />

    <AudioEncoderCap name="aac" enabled="true"
        minBitRate="8000" maxBitRate="96000"
        minSampleRate="8000" maxSampleRate="48000"
        minChannels="1" maxChannels="6" />

    <AudioEncoderCap name="heaac" enabled="true"
        minBitRate="8000" maxBitRate="64000"
        minSampleRate="16000" maxSampleRate="48000"
        minChannels="1" maxChannels="1" />

    <AudioEncoderCap name="aaceld" enabled="true"
        minBitRate="16000" maxBitRate="192000"
        minSampleRate="16000" maxSampleRate="48000"
        minChannels="1" maxChannels="1" />

    <AudioEncoderCap name="amrwb" enabled="true"
        minBitRate="6600" maxBitRate="23850"
        minSampleRate="16000" maxSampleRate="16000"
        minChannels="1" maxChannels="1" />

    <AudioEncoderCap name="amrnb" enabled="true"
        minBitRate="5525" maxBitRate="12200"
        minSampleRate="8000" maxSampleRate="8000"
        minChannels="1" maxChannels="1" />

    <AudioEncoderCap name="lpcm" enabled="true"
        minBitRate="768000" maxBitRate="4608000"
        minSampleRate="8000" maxSampleRate="48000"
        minChannels="1" maxChannels="6" />

    <!--
        FIXME:
        We do not check decoder capabilities at present
        At present, we only check whether windows media is visible
        for TEST applications. For other applications, we do
        not perform any checks at all.
    -->
    <VideoDecoderCap name="wmv" enabled="true"/>
    <AudioDecoderCap name="wma" enabled="true"/>

    <!--
        The VideoEditor Capability configuration:
        - maxInputFrameWidth: maximum video width of imported video clip.
        - maxInputFrameHeight: maximum video height of imported video clip.
        - maxOutputFrameWidth: maximum video width of exported video clip.
        - maxOutputFrameHeight: maximum video height of exported video clip.
        - maxPrefetchYUVFrames: maximum prefetch YUV frames for encoder,
        used to limit the amount of memory for prefetched YUV frames.
        For this platform, it allows maximum 30MB(3MB per 1080p frame x 10
        frames) memory.
    -->
    <VideoEditorCap  maxInputFrameWidth="1920"
        maxInputFrameHeight="1088" maxOutputFrameWidth="1920"
        maxOutputFrameHeight="1088" maxPrefetchYUVFrames="10"/>
    <!--
        The VideoEditor Export codec profile and level values
        correspond to the values in OMX_Video.h.
        E.g. for h264, profile value 1 means OMX_VIDEO_AVCProfileBaseline
        and  level 4096 means OMX_VIDEO_AVCLevel41.
        Please note that the values are in decimal.
        These values are for video encoder.
    -->
    <!--
      Codec = h.264, Baseline profile, level 4.0
    -->
    <ExportVideoProfile name="h264" profile= "1" level="2048"/>
    <!--
      Codec = h.263, Baseline profile, level 70
    -->
    <ExportVideoProfile name="h263" profile= "1" level="128"/>
    <!--
      Codec = mpeg4, Simple profile, level 5
    -->
    <ExportVideoProfile name="m4v" profile= "1" level="128"/>
</MediaSettings>
